{
  "$defs": {
    "ModelWindowQuery": {
      "additionalProperties": false,
      "description": "Select exactly one model version, half-open event window and label cutoff.",
      "properties": {
        "as_of": {
          "format": "date-time",
          "title": "As Of",
          "type": "string"
        },
        "dataset_ref": {
          "anyOf": [
            {
              "maxLength": 128,
              "minLength": 1,
              "type": "string"
            },
            {
              "type": "null"
            }
          ],
          "default": null,
          "title": "Dataset Ref"
        },
        "model_name": {
          "maxLength": 128,
          "minLength": 1,
          "title": "Model Name",
          "type": "string"
        },
        "model_version": {
          "maxLength": 128,
          "minLength": 1,
          "title": "Model Version",
          "type": "string"
        },
        "window_end": {
          "format": "date-time",
          "title": "Window End",
          "type": "string"
        },
        "window_start": {
          "format": "date-time",
          "title": "Window Start",
          "type": "string"
        }
      },
      "required": [
        "model_name",
        "model_version",
        "window_start",
        "window_end",
        "as_of"
      ],
      "title": "ModelWindowQuery",
      "type": "object"
    }
  },
  "$schema": "https://json-schema.org/draft/2020-12/schema",
  "additionalProperties": false,
  "description": "File paths are resolved relative to the config file by the CLI.",
  "properties": {
    "baseline_file": {
      "format": "path",
      "title": "Baseline File",
      "type": "string"
    },
    "labels_file": {
      "format": "path",
      "title": "Labels File",
      "type": "string"
    },
    "predictions_file": {
      "format": "path",
      "title": "Predictions File",
      "type": "string"
    },
    "query": {
      "$ref": "#/$defs/ModelWindowQuery"
    }
  },
  "required": [
    "query",
    "baseline_file",
    "predictions_file",
    "labels_file"
  ],
  "title": "LocalSourceConfig",
  "type": "object"
}
